link,text,type,author,author_link,date,likes,comments,reposts,views,keywords_matched
https://vk.com/wall-216074633_3068,"Эпоха пунических войн 
Подстрекаемые Клавдием мамертинцы захватили в плен командующего местным карфагенским гарнизоном по имени Ганнон, которому была обещана свобода — но при условии, что он эвакуирует солдат из городской цитадели. Ганнон уступил этим требованиям, за что впоследствии по решению Совета старейшин был распят. Так началась Первая пуническая война, которая поставила новые, ещё более сложные задачи — как перед правителями Карфагена, так и перед его полководцами. Дальнейшее развитие событий показало, что с возникшими проблемами не справились ни те, ни другие. 
 
Боевые действия развернулись и большей частью проходили на территории Сицилии. Пассивные действия карфагенян, которые не приняли никаких решительных мер для того, чтобы как можно быстрее ликвидировать пока ещё небольшой вражеский плацдарм, привели к тому, что в 263 году до н.э. к Риму переметнулся Гиерон II, который поначалу был на стороне пунийцев. Это позволило римлянам получить в его лице отличного союзника, предоставившего свой флот и наладившего снабжение легионеров продовольствием. В 262 году до н.э. произошло первое крупное сухопутное сражение: карфагенский полководец Ганнон, прибывший на Сицилию с 30 000 войска, попытался снять осаду с города Акрагант, но попал в устроенную ему римлянами засаду, потерпел сокрушительное поражение и был отозван в Африку. Там он предстал перед Судом ста четырёх, но смертной казни избежал. 
 
На смену Ганнону из Карфагена прибыл полководец по имени Гамилькар, которому удалось добиться ряда локальных успехов. Но принципиально это ничего не изменило: несмотря на то, что римские консулы ежегодно менялись, а пунийские полководцы оставались на своих местах, римлянам удалось захватить немало городов и крепостей. Карфагеняне продолжали уступать противнику как на суше, так совершенно неожиданно для себя и на море. В 260 году до н.э. в первом крупном морском сражении при Милах римляне нанесли пунийцам сокрушительное поражение благодаря новому изобретению — «ворону», при помощи которого легионеры перебегали на борт вражеского корабля и быстро расправлялись с его командой. 
 
Командовавший карфагенским флотом Ганнибал, понимая, что ему грозит смертная казнь за эту неудачу, пошёл на хитрость. Он послал в Карфаген одного из своих друзей, который на заседании Совета старейшин заявил, что Ганнибал приказал ему спросить: имеет ли смысл ему при наличии флота из 200 кораблей вступить в бой с римским флотом в 120 кораблей? Старейшины единогласно потребовали начать сражение. Посланник ответил: «Очень хорошо, именно поэтому Ганнибал бился, и мы были разбиты. Но поскольку вы дали приказ, он избавлен от порицания». 
 
В итоге полководец был снят со своего поста, но жизнь ему всё же сохранили. Однако от судьбы не уйти: в 258 году до н.э. Ганнибала снова поставили во главе флота, который действовал на Сардинии. Он и на этот раз потерпел неудачу: ловким манёвром римляне заперли его корабли в одной из гаваней и почти все потопили. В итоге Ганнибал всё-таки был распят, причём собственными солдатами. 
 
Одержав ряд побед на Сицилии, римляне в 256 году до н.э. решили повторить опыт Агафокла и добиться успеха в Африке, отправив туда флот и армию, суммарно насчитывавшие 140 000 человек. Карфагенские адмиралы попытались помешать этому, но в битве у мыса Экном их флот в очередной раз был разбит. Римские консулы Луций Манлий Вульсон и Марк Аттилий Регул успешно высадились у Аспиды и энергично начали расширять захваченный плацдарм. За короткое время в их руки попало 20 000 пленных и большие трофеи. Уверенность в своём дальнейшем успехе у римлян была столь высока, что в конце года Вульсон с частью войска, пленными и наиболее ценной добычей отплыл в Италию, а Регул с оставшейся у него армией остался на зимовку в Африке. 
 
Карфагеняне поспешно избрали двух новых полководцев: Бостара и Гасдрубала, сына Ганнона. Затем они вызвали с Сицилии третьего, всё того же Гамилькара, который на тот момент был наиболее опытным пунийским военачальником. Но в битве при Адисе в 256 году до н.э. значительно уступавший противнику в численности войска Аттилий Регул разгромил вражескую армию. Главной причиной этого поражения была тактическая бездарность Гамилькара. Карфагеняне запросили мира, однако Регул поставил им столь жёсткий ультиматум, что было решено продолжать войну. 
 
Срочно были набраны новые отряды наёмников, среди которых оказались и греки. Один из их командиров, спартанец по имени Ксантипп, узнав подробности битвы при Адисе, сказал, что «карфагеняне понесли поражение не от римлян, но от себя самих благодаря неопытности своих вождей». Совет старейшин пригласил его на беседу, в ходе которой Ксантипп показал себя настоящим профессионалом и объяснил, в чём была ошибка пунийских полководцев: обладавшие такими козырями, как слоны и превосходная конница, они не использовали для сражений открытую местность. 
 
В итоге Совет старейшин принял беспрецедентное решение: во главе войска впервые за много веков был поставлен не представитель местной аристократии, а спартанский наёмник! Ксантипп в течение нескольких месяцев обучал и тренировал карфагенскую армию согласно своим тактическим принципам, и это принесло успех: весной 255 года до н.э. он наголову разбил армию Регула в битве при Тунете. 
 
Это была единственная крупная сухопутная победа карфагенян за всю войну. После неё с Ксантиппом расплатились и поспешно отправили его на родину, а на Сицилии снова возобновились боевые действия. Карфагеняне попытались внести в них перелом и отправили на остров Гасдрубала, дав ему 140 слонов и 30 000 войска. В 251 году до н.э. он попытался отбить обратно Панорм, но при этом опрометчиво подвёл слонов вплотную к окружавшему стены рву, где они попали под обстрел с городских укреплений и в испуге бросились врассыпную, топча своё войско. Римские войска тут же вышли через ворота и атаковали карфагенян. 
 
В итоге Гасдрубал потерпел поражение и потерял 20 000 пехотинцев и почти всех слонов, которые попали в руки римлян и впоследствии были использованы во время гладиаторских боев. С остатками войска незадачливый полководец бежал в Лилибей. Судом ста четырёх в Карфагене он был заочно приговорён к смертной казни. Позже приговор привели в исполнение, однако распинать Гасдрубала не стали, а просто посадили на кол. 
 
Заменивший Гасдрубала на Сицилии Гамилькар Барка уже не стремился к крупным сражениям: он свёл боевые действия к множеству небольших схваток, используя набеги и диверсии, и в мелких стычках непрерывно изматывал неприятеля. Такая тактика в течение нескольких лет сделала ситуацию на Сицилии патовой: римляне так и не смогли очистить остров от противника, не стремились к этому и карфагеняне. В итоге всё решилось на море: в 241 году до н.э. римляне разгромили пунийцев в битве при Эгатских островах, что принесло им победу в этой войне. Командовавший потерпевшим поражение карфагенским флотом военачальник по имени Ганнон был традиционно распят. 
 
Баркиды 
Роль Гамилькара Барки в истории Карфагена трудно переоценить. Он своим упорным сопротивлением на Сицилии, а затем и личным участием в мирных переговорах позволил Карфагену достойно завершить Первую пуническую войну. Затем он фактически единолично спас город во время восстания наёмников. Примечательно, что во время этих событий доказал свою полную бездарность ещё один пунийский военачальник — Ганнон Великий. Наконец, именно Гамилькар Барка возглавил испанский проект, который позволил Карфагену возродить свою мощь. 
 
На территории Пиренейского полуострова Гамилькар в течение девяти лет расширял пределы пунийского владычества в Испании, но закончить свою миссию ему было не суждено: он погиб в одной из стычек с местными иберийскими племенами. Место Гамилькара занял его зять Гасдрубал Красивый, но через восемь лет и он был убит. Так как пунийская армия находилась вдалеке от Карфагена и дважды по причине гибели военачальника оказывалась обезглавленной, главнокомандующего в обоих случаях избирало войсковое собрание. Однако впоследствии оба этих решения всё равно утверждались в Карфагене на народной ассамблее. Своих сыновей Гамилькар воспитывал как профессиональных военных. Неудивительно, что именно Баркиды повели в бой карфагенские армии во Второй пунической войне. 
 
Вторая пуническая 
Ганнибал, возглавивший поход в Италию, прекрасно понимал, в чём основное преимущество римлян: они имели такую совершенную боевую структуру, как легионы. Их наличие позволяло римским полководцам особо не ломать голову, как одолеть противника в открытом бою. Но полководческий гений позволил Ганнибалу в первые годы войны одержать ряд ошеломляющих побед, добиться которых позволили различные военные хитрости и прекрасная разведка. Однако это не могло продолжаться вечно, и римляне вскоре нашли противоядие против тактики пунийца. Избегая крупных сражений и преследуя его армию по пятам, римские полководцы в постоянных стычках изматывали войско Ганнибала, который с большим трудом находил замену погибшим воинам. 
 
В то время, пока Ганнибал в Италии одерживал блестящие победы над противником, значительно превосходившим его по численности, в Испании наблюдалась совершенно иная картина. Находившиеся там карфагенские армии, возглавляемые братьями Ганнибала Гасдрубалом и Магоном, а также другими пунийскими полководцами, потерпели ряд поражений от братьев Гнея и Публия Сципионов, которым за шесть лет удалось захватить значительную часть Испании. 
 
Когда в 212 году до н.э. обе римских армии всё-таки были разбиты совместными усилиями карфагенских полководцев, а оба Сципиона погибли, на смену отцу и дяде в Испанию пришёл Корнелий Публий Сципион-младший. Он, по словам Полибия, уже знал, что «начальники карфагенян ссорятся между собою и обижают подчинённые им народы», а также о том, что «войска карфагенян разделены на три части, что одна из них с Магоном во главе находится по сию сторону Геракловых Столбов среди так называемых кониев, другая под начальством сына Гескона Гасдрубала — у устья реки Тага в Луситании, что другой Гасдрубал (Барка — прим. авт.) занят осадою какого-то города в области карпетанов, и что ни один из начальников не находится ближе к Новому городу, как на десять дней пути». 
 
Воспользовавшись разобщённостью противника, Сципион сначала захватил Новый Карфаген, бывший основной материальной базой пунийцев в Испании. Затем он поочерёдно разбил армии Гасдрубала Барки и Магона Барки, а также ещё одного карфагенского полководца Гасдрубала Гискона. Впрочем, ещё раньше тот потерпел поражение от Гнея Сципиона, а затем и от недавнего военного трибуна Луция Септима, возглавившего в 212 году до н.э. остатки разгромленного римского войска. В итоге в 206 году до н.э. Сципион практически полностью очистил от карфагенян всю Испанию. К этому времени Ганнибал был прочно заперт на юге Италии и опасности для Рима уже не представлял. Неудачей закончились и попытки карфагенян овладеть Сицилией и Сардинией. 
 
Одной из особенностей Второй пунической было то, что отличие от предыдущей войны боевые действия между противниками разворачивалась одновременно на нескольких фронтах: в Италии и Испании, на Сицилии и Сардинии, а затем переместились в Африку. В ходе этих событий Рим оказался способен выставить на смену погибшим или не справившимся со своими обязанностями целую плеяду новых талантливых военачальников, которые использовали различную тактику, но исход во всех случаях был одинаков: римляне везде брали верх. Карфаген не сумел ничего этому противопоставить. Его военачальники традиционно оставались у руля даже после самых сокрушительных поражений. 
 
Самым ярким примером служит личность всё того же Гасдрубала Гискона. Именно он может служить примером наиболее типичного карфагенского полководца периода Второй пунической войны, во время которой только один Ганнибал смог многократно одержать победу над римлянами. Все остальные его коллеги регулярно терпели поражения, и лишь в 212 году до н.э. они смогли совместными усилиями взять в Испании верх над братьями Гнеем и Публием Сципионами. Но для общей победы этого оказалось явно недостаточно. 
 
Система государственного устройства Римской республики способствовала тому, что в её армии не было недостатка в профессиональных военачальниках. Всеобщая воинская обязанность давала каждому римскому гражданину азы военных знаний, а постоянные войны прибавляли к ним необходимый опыт участия в походах и сражениях. На этой почве у Рима не было проблем с наличием профессиональных офицеров, из которых и получались успешные полководцы. Иное дело Карфаген, граждане которого были избавлены от воинской повинности. Не стремилась пунийская держава и к ведению постоянных захватнических войн, а вела их только по мере необходимости. В этих условиях появление выдающегося полководца было делом случая, а не системы. 
 
Фигура Ганнибала Барки является уникальной для Карфагена. После поражения в Первой пунической войне в государственной системе Карфагена ничего не изменилось. Решение Гамилькара Барки вырастить из своих сыновей профессиональных военных было исключительно его личной инициативой. Ганнибалу в этом плане очень повезло: он получил блестящее военное образование, подкреплённое богатым практическим опытом. Вне всякого сомнения, имелся у него и природный талант, но если бы он получил то же воспитание, какое до этого было у многих поколений детей карфагенских аристократов, суждено ли было ему стать великим полководцем такого масштаба? Вопрос риторический. 
 
Примечательно, что младшие братья Ганнибала оказались далеко не такими выдающимися военачальниками. Кто знает, может они были бы более удачливыми на поле брани, не появись у них на пути будущий Сципион Африканский. Впрочем, в борьбе против его отца и дяди успех к Баркидам тоже пришёл далеко не сразу, а только спустя шесть лет и во многом благодаря успешным действиям Гасдрубала Барки на ниве подкупа иберийских вождей. Когда в Испании появился Сципион-младший, он не оставил братьям Ганнибала никаких шансов. 
 
Почти не приходится удивляться тому, что когда римская экспедиционная армия высадилась в Африке, главнокомандующим войсками в Африке Совет старейшин поставил всё того же Гасдрубала Гискона, хотя, по словам Ливия, «все помнили, что он в нескольких сражениях был разбит и выгнан из Испании этим самым Сципионом: карфагенского вождя нельзя было и сравнить с римским, так же, как его наспех набранное войско с войском римлян». 
 
Увы, из небольшого количества имевшихся у него военачальников никаких новых фигур Карфаген выставить не сумел. Нового Ксантиппа или Гамилькара Барки в этот раз не нашлось. В итоге высадившийся в Африке Сципион в 203 году до н.э. ещё дважды уничтожил армии Гасдрубала Гискона: сначала после поджога неприятельского лагеря близ Утики, а затем в ходе сражения на Великих равнинах. После того, как в 202 году до н.э. в битве при Заме Сципион нанёс сокрушительное поражение и старшему из Баркидов, доселе непобедимому Ганнибалу, Вторая пуническая завершилась победой Рима. 
 
Помимо общего превосходства римских полководцев, армии и флота над своими карфагенскими оппонентами, в качестве одной из главных причин победы необходимо упомянуть и решимость римских граждан вести войну до победного конца. Совокупность всех этих факторов и привела к тому, что Рим одержал убедительную победу.

Третья пуническая 
Последним карфагенским полководцем было суждено стать Гасдрубалу Боэтарху, о котором которого Полибий пишет, что он был «тщеславный хвастун, вовсе не обладавший дарованиями ни государственного человека, ни главнокомандующего». Гасдрубал Боэтарх известен тем, что ещё до начала Третьей пунической войны возглавил набранное из гражданского ополчения войско в 58 000 человек во время войны против нумидийцев, которые постоянно нападали на Карфаген и захватывали принадлежавшие ему территории. В 151 году до н.э. престарелый нумидийский царь Масинисса заманил пунийскую армию в ловушку на равнине, окружённой со всех сторон холмами, и практически полностью уничтожил войско противника. Гасдрубал Боэтарх был одним из немногих спасшихся.",Пост,,,23:56 24.07.2025,1,0,0,20,
