link,text,type,author,author_link,date,likes,comments,reposts,views,keywords_matched
https://vk.com/wall-35276355_2479633,"""Тут всё мое родное"": реалии города Курахово

Сегодня наш военкор Глеб Подтоптаный отправился в освобожденный город Курахово, чтобы узнать, как живут местные после боевых действий. Несмотря на наступившую тишину, последствия войны ощущаются остро: нет света и воды. Люди выживают благодаря помощи — воду приносят из гуманитарного центра и храма, электричество получают от генераторов. 
 
Пенсионер Николай Васильевич рассказал, как пережил самые тяжёлые дни. Он получил два ранения и контузию, но не покинул родной дом и не бросил трёх собак. Хвостатые друзья остались рядом даже в самые страшные моменты — вместе прошли через обстрелы и одиночество. 
 
Сегодня Курахово также посетили активисты ""Движения Первых"". Они навестили 11 детей, которые сейчас проживают здесь с семьями, и передали им подарки: канцелярские наборы, книги, сладости и письма от сверстников из Донецка. 
 
""Этим детям не хватает общения и поддержки. Наша задача — показать, что они не одни. Мы рядом"", — отметил руководитель ""Движения Первых"" в ДНР Денис Чернобай. 
 
Сейчас в Курахово живут около тысячи человек. Работают несколько продуктовых магазинов, два раза в неделю из города ходит автобус до Донецка. Люди держатся за свою землю и стараются наладить быт в новых условиях.",Пост,,,03:54 24.07.2025,61,4,5,3819,
